{
  "dataset_id": "core.py_inspect_source",
  "snapshot_id": "3c5af2164daa028b369ed5d8f6a460dc1b2f085d",
  "table_key": "core.py_inspect_source",
  "partition_columns": [
    "repo",
    "commit"
  ],
  "files": [],
  "schema_hash": "1912982f1ce00a4fd17651afb3d266ab8e3cb2c72b78dbe7c97626fd000fe2a6",
  "row_count": 0,
  "created_at": "2026-01-04T14:26:44.688771+00:00",
  "extras": {
    "provenance": {
      "derivation_kind": "explicit_override",
      "derivation_source": "inspect"
    },
    "settings_fingerprint": "d084197d240ab41f2f8aaf3f4fba09c61eddb74e218bcbd4a288e68f33c189d6",
    "table_schema": {
      "columns": [
        {
          "description": null,
          "name": "repo",
          "nullable": false,
          "type": "VARCHAR"
        },
        {
          "description": null,
          "name": "commit",
          "nullable": false,
          "type": "VARCHAR"
        },
        {
          "description": null,
          "name": "mode",
          "nullable": false,
          "type": "VARCHAR"
        },
        {
          "description": null,
          "name": "object_id",
          "nullable": false,
          "type": "VARCHAR"
        },
        {
          "description": null,
          "name": "file_name",
          "nullable": true,
          "type": "VARCHAR"
        },
        {
          "description": null,
          "name": "start_line",
          "nullable": true,
          "type": "INTEGER"
        },
        {
          "description": null,
          "name": "line_count",
          "nullable": true,
          "type": "INTEGER"
        },
        {
          "description": null,
          "name": "source_sha256",
          "nullable": true,
          "type": "BLOB"
        },
        {
          "description": null,
          "name": "source_preview",
          "nullable": true,
          "type": "VARCHAR"
        },
        {
          "description": null,
          "name": "status",
          "nullable": true,
          "type": "STRUCT(ok BOOLEAN, error_type VARCHAR, error_msg VARCHAR)"
        }
      ],
      "description": "Source anchoring data for inspect objects.",
      "indexes": [],
      "name": "py_inspect_source",
      "primary_key": [
        "repo",
        "commit",
        "object_id"
      ],
      "schema": "core",
      "table_key": "core.py_inspect_source"
    },
    "write_settings": {
      "dictionary_encode": false,
      "unify_dictionaries": false
    }
  }
}
