{
  "dataset_id": "core.scip_module_state",
  "snapshot_id": "3c5af2164daa028b369ed5d8f6a460dc1b2f085d",
  "table_key": "core.scip_module_state",
  "partition_columns": [
    "repo",
    "commit"
  ],
  "files": [],
  "schema_hash": "3f65d61fa1b0f4e78dfe5cb40632786f65d836c95a4b730dd8053ea4efc3cc96",
  "row_count": 0,
  "created_at": "2026-01-04T14:26:46.475000+00:00",
  "extras": {
    "provenance": {
      "derivation_kind": "explicit_override",
      "derivation_source": "scip"
    },
    "settings_fingerprint": "d084197d240ab41f2f8aaf3f4fba09c61eddb74e218bcbd4a288e68f33c189d6",
    "table_schema": {
      "columns": [
        {
          "description": null,
          "name": "repo",
          "nullable": false,
          "type": "VARCHAR"
        },
        {
          "description": null,
          "name": "commit",
          "nullable": false,
          "type": "VARCHAR"
        },
        {
          "description": null,
          "name": "rel_path",
          "nullable": false,
          "type": "VARCHAR"
        },
        {
          "description": null,
          "name": "content_hash",
          "nullable": false,
          "type": "VARCHAR"
        },
        {
          "description": null,
          "name": "options_hash",
          "nullable": true,
          "type": "VARCHAR"
        },
        {
          "description": null,
          "name": "tool_version",
          "nullable": true,
          "type": "VARCHAR"
        },
        {
          "description": null,
          "name": "shard_path",
          "nullable": false,
          "type": "VARCHAR"
        },
        {
          "description": null,
          "name": "updated_at",
          "nullable": false,
          "type": "TIMESTAMP"
        }
      ],
      "description": "Per-module SCIP shard state for incremental updates",
      "indexes": [
        {
          "columns": [
            "rel_path"
          ],
          "name": "idx_core_scip_module_state_path",
          "unique": false
        },
        {
          "columns": [
            "repo",
            "commit"
          ],
          "name": "idx_core_scip_module_state_repo_commit",
          "unique": false
        }
      ],
      "name": "scip_module_state",
      "primary_key": [
        "repo",
        "commit",
        "rel_path"
      ],
      "schema": "core",
      "table_key": "core.scip_module_state"
    },
    "write_settings": {
      "dictionary_encode": false,
      "unify_dictionaries": false
    }
  }
}
