{
  "dataset_id": "graph.import_modules",
  "snapshot_id": "3c5af2164daa028b369ed5d8f6a460dc1b2f085d",
  "table_key": "graph.import_modules",
  "partition_columns": [
    "repo",
    "commit"
  ],
  "files": [],
  "schema_hash": "c1289d1f3103eccc6aced55aeec25ad47e796c370c89de460fda8b06b5a5baa0",
  "row_count": 0,
  "created_at": "2026-01-04T14:26:40.425775+00:00",
  "extras": {
    "provenance": {
      "derivation_kind": "explicit_override",
      "derivation_source": "import_graph"
    },
    "settings_fingerprint": "d084197d240ab41f2f8aaf3f4fba09c61eddb74e218bcbd4a288e68f33c189d6",
    "table_schema": {
      "columns": [
        {
          "description": null,
          "name": "repo",
          "nullable": false,
          "type": "VARCHAR"
        },
        {
          "description": null,
          "name": "commit",
          "nullable": false,
          "type": "VARCHAR"
        },
        {
          "description": null,
          "name": "module",
          "nullable": false,
          "type": "VARCHAR"
        },
        {
          "description": null,
          "name": "scc_id",
          "nullable": false,
          "type": "INTEGER"
        },
        {
          "description": null,
          "name": "component_size",
          "nullable": false,
          "type": "INTEGER"
        },
        {
          "description": null,
          "name": "layer",
          "nullable": true,
          "type": "INTEGER"
        },
        {
          "description": null,
          "name": "cycle_group",
          "nullable": false,
          "type": "INTEGER"
        }
      ],
      "description": "Per-module import graph condensation metadata keyed by repo/commit",
      "indexes": [
        {
          "columns": [
            "repo",
            "commit"
          ],
          "name": "idx_graph_import_modules_repo_commit",
          "unique": false
        },
        {
          "columns": [
            "module"
          ],
          "name": "idx_graph_import_modules_module",
          "unique": false
        }
      ],
      "name": "import_modules",
      "primary_key": [],
      "schema": "graph",
      "table_key": "graph.import_modules"
    },
    "write_settings": {
      "dictionary_encode": false,
      "unify_dictionaries": false
    }
  }
}
