{
  "dataset_id": "graph.cfg_edges",
  "snapshot_id": "3c5af2164daa028b369ed5d8f6a460dc1b2f085d",
  "table_key": "graph.cfg_edges",
  "partition_columns": [],
  "files": [],
  "schema_hash": "83f5e12505cbd2278102ea256ddf06c702f5d54ba0639f6444d5fc963877a3e3",
  "row_count": 0,
  "created_at": "2026-01-04T14:26:34.905706+00:00",
  "extras": {
    "provenance": {
      "derivation_kind": "explicit_override",
      "derivation_source": "cfg"
    },
    "settings_fingerprint": "d084197d240ab41f2f8aaf3f4fba09c61eddb74e218bcbd4a288e68f33c189d6",
    "table_schema": {
      "columns": [
        {
          "description": null,
          "name": "function_goid_h128",
          "nullable": false,
          "type": "DECIMAL(38,0)"
        },
        {
          "description": null,
          "name": "src_block_id",
          "nullable": false,
          "type": "VARCHAR"
        },
        {
          "description": null,
          "name": "dst_block_id",
          "nullable": false,
          "type": "VARCHAR"
        },
        {
          "description": null,
          "name": "edge_kind",
          "nullable": true,
          "type": "VARCHAR"
        }
      ],
      "description": "Control-flow edges between blocks",
      "indexes": [
        {
          "columns": [
            "function_goid_h128"
          ],
          "name": "idx_graph_cfg_edges_fn",
          "unique": false
        }
      ],
      "name": "cfg_edges",
      "primary_key": [],
      "schema": "graph",
      "table_key": "graph.cfg_edges"
    },
    "write_settings": {
      "dictionary_encode": false,
      "unify_dictionaries": false
    }
  }
}
