{
  "dataset_id": "core.py_bc_code_units",
  "snapshot_id": "3c5af2164daa028b369ed5d8f6a460dc1b2f085d",
  "table_key": "core.py_bc_code_units",
  "partition_columns": [
    "repo",
    "commit"
  ],
  "files": [],
  "schema_hash": "2f54d5f9951b2221ac20632e0bdda752bf5d237c5efde4f01c36a92561a28216",
  "row_count": 0,
  "created_at": "2026-01-04T14:26:42.050621+00:00",
  "extras": {
    "provenance": {
      "derivation_kind": "explicit_override",
      "derivation_source": "bytecode"
    },
    "settings_fingerprint": "d084197d240ab41f2f8aaf3f4fba09c61eddb74e218bcbd4a288e68f33c189d6",
    "table_schema": {
      "columns": [
        {
          "description": null,
          "name": "repo",
          "nullable": false,
          "type": "VARCHAR"
        },
        {
          "description": null,
          "name": "commit",
          "nullable": false,
          "type": "VARCHAR"
        },
        {
          "description": null,
          "name": "rel_path",
          "nullable": false,
          "type": "VARCHAR"
        },
        {
          "description": null,
          "name": "code_unit_id",
          "nullable": false,
          "type": "VARCHAR"
        },
        {
          "description": null,
          "name": "parent_code_unit_id",
          "nullable": true,
          "type": "VARCHAR"
        },
        {
          "description": null,
          "name": "qualpath",
          "nullable": true,
          "type": "VARCHAR"
        },
        {
          "description": null,
          "name": "co_name",
          "nullable": true,
          "type": "VARCHAR"
        },
        {
          "description": null,
          "name": "co_qualname",
          "nullable": true,
          "type": "VARCHAR"
        },
        {
          "description": null,
          "name": "kind",
          "nullable": true,
          "type": "VARCHAR"
        },
        {
          "description": null,
          "name": "co_firstlineno",
          "nullable": true,
          "type": "INTEGER"
        },
        {
          "description": null,
          "name": "span_start_byte",
          "nullable": true,
          "type": "BIGINT"
        },
        {
          "description": null,
          "name": "span_end_byte",
          "nullable": true,
          "type": "BIGINT"
        },
        {
          "description": null,
          "name": "flags",
          "nullable": true,
          "type": "INTEGER"
        },
        {
          "description": null,
          "name": "argcount",
          "nullable": true,
          "type": "INTEGER"
        },
        {
          "description": null,
          "name": "posonlyargcount",
          "nullable": true,
          "type": "INTEGER"
        },
        {
          "description": null,
          "name": "kwonlyargcount",
          "nullable": true,
          "type": "INTEGER"
        },
        {
          "description": null,
          "name": "nlocals",
          "nullable": true,
          "type": "INTEGER"
        },
        {
          "description": null,
          "name": "stacksize",
          "nullable": true,
          "type": "INTEGER"
        },
        {
          "description": null,
          "name": "varnames",
          "nullable": true,
          "type": "LIST(VARCHAR)"
        },
        {
          "description": null,
          "name": "names",
          "nullable": true,
          "type": "LIST(VARCHAR)"
        },
        {
          "description": null,
          "name": "freevars",
          "nullable": true,
          "type": "LIST(VARCHAR)"
        },
        {
          "description": null,
          "name": "cellvars",
          "nullable": true,
          "type": "LIST(VARCHAR)"
        },
        {
          "description": null,
          "name": "bytecode_len",
          "nullable": true,
          "type": "INTEGER"
        },
        {
          "description": null,
          "name": "exceptiontable_len",
          "nullable": true,
          "type": "INTEGER"
        },
        {
          "description": null,
          "name": "python_version",
          "nullable": true,
          "type": "VARCHAR"
        },
        {
          "description": null,
          "name": "bytecode_magic",
          "nullable": true,
          "type": "BLOB"
        },
        {
          "description": null,
          "name": "optimize",
          "nullable": true,
          "type": "INTEGER"
        },
        {
          "description": null,
          "name": "dont_inherit",
          "nullable": true,
          "type": "BOOLEAN"
        }
      ],
      "description": "Python bytecode code unit inventory.",
      "indexes": [],
      "name": "py_bc_code_units",
      "primary_key": [
        "repo",
        "commit",
        "rel_path",
        "code_unit_id"
      ],
      "schema": "core",
      "table_key": "core.py_bc_code_units"
    },
    "write_settings": {
      "dictionary_encode": false,
      "unify_dictionaries": false
    }
  }
}
