{
  "dataset_id": "core.docstrings",
  "snapshot_id": "3c5af2164daa028b369ed5d8f6a460dc1b2f085d",
  "table_key": "core.docstrings",
  "partition_columns": [
    "repo",
    "commit"
  ],
  "files": [],
  "schema_hash": "a461c8e1ca6c513948fc73eb9ee974b485ee25af7e89dc8ffb115996a54e4419",
  "row_count": 0,
  "created_at": "2026-01-04T14:26:43.231399+00:00",
  "extras": {
    "provenance": {
      "derivation_kind": "explicit_override",
      "derivation_source": "docstrings"
    },
    "settings_fingerprint": "d084197d240ab41f2f8aaf3f4fba09c61eddb74e218bcbd4a288e68f33c189d6",
    "table_schema": {
      "columns": [
        {
          "description": null,
          "name": "repo",
          "nullable": false,
          "type": "VARCHAR"
        },
        {
          "description": null,
          "name": "commit",
          "nullable": false,
          "type": "VARCHAR"
        },
        {
          "description": null,
          "name": "rel_path",
          "nullable": false,
          "type": "VARCHAR"
        },
        {
          "description": null,
          "name": "module",
          "nullable": false,
          "type": "VARCHAR"
        },
        {
          "description": null,
          "name": "qualname",
          "nullable": false,
          "type": "VARCHAR"
        },
        {
          "description": null,
          "name": "kind",
          "nullable": false,
          "type": "VARCHAR"
        },
        {
          "description": null,
          "name": "lineno",
          "nullable": true,
          "type": "INTEGER"
        },
        {
          "description": null,
          "name": "end_lineno",
          "nullable": true,
          "type": "INTEGER"
        },
        {
          "description": null,
          "name": "raw_docstring",
          "nullable": true,
          "type": "VARCHAR"
        },
        {
          "description": null,
          "name": "style",
          "nullable": true,
          "type": "VARCHAR"
        },
        {
          "description": null,
          "name": "short_desc",
          "nullable": true,
          "type": "VARCHAR"
        },
        {
          "description": null,
          "name": "long_desc",
          "nullable": true,
          "type": "VARCHAR"
        },
        {
          "description": null,
          "name": "params",
          "nullable": true,
          "type": "LIST(STRUCT(name VARCHAR, type_name VARCHAR, description VARCHAR))"
        },
        {
          "description": null,
          "name": "returns",
          "nullable": true,
          "type": "STRUCT(type_name VARCHAR, description VARCHAR)"
        },
        {
          "description": null,
          "name": "raises",
          "nullable": true,
          "type": "LIST(STRUCT(type_name VARCHAR, description VARCHAR))"
        },
        {
          "description": null,
          "name": "examples",
          "nullable": true,
          "type": "LIST(VARCHAR)"
        },
        {
          "description": null,
          "name": "created_at",
          "nullable": false,
          "type": "TIMESTAMP"
        }
      ],
      "description": "Structured docstring facts extracted with griffe",
      "indexes": [],
      "name": "docstrings",
      "primary_key": [],
      "schema": "core",
      "table_key": "core.docstrings"
    },
    "write_settings": {
      "dictionary_encode": false,
      "unify_dictionaries": false
    }
  }
}
