{
  "dataset_id": "core.py_inspect_unwrap_hops",
  "snapshot_id": "3c5af2164daa028b369ed5d8f6a460dc1b2f085d",
  "table_key": "core.py_inspect_unwrap_hops",
  "partition_columns": [
    "repo",
    "commit"
  ],
  "files": [],
  "schema_hash": "41d06c8616b535caf9d49b7d14463e583012cf9821c92c0ec9fd4e537d86e207",
  "row_count": 0,
  "created_at": "2026-01-04T14:26:44.066324+00:00",
  "extras": {
    "provenance": {
      "derivation_kind": "explicit_override",
      "derivation_source": "inspect"
    },
    "settings_fingerprint": "d084197d240ab41f2f8aaf3f4fba09c61eddb74e218bcbd4a288e68f33c189d6",
    "table_schema": {
      "columns": [
        {
          "description": null,
          "name": "repo",
          "nullable": false,
          "type": "VARCHAR"
        },
        {
          "description": null,
          "name": "commit",
          "nullable": false,
          "type": "VARCHAR"
        },
        {
          "description": null,
          "name": "mode",
          "nullable": false,
          "type": "VARCHAR"
        },
        {
          "description": null,
          "name": "root_object_id",
          "nullable": false,
          "type": "VARCHAR"
        },
        {
          "description": null,
          "name": "hop",
          "nullable": false,
          "type": "INTEGER"
        },
        {
          "description": null,
          "name": "object_id",
          "nullable": true,
          "type": "VARCHAR"
        },
        {
          "description": null,
          "name": "has_wrapped",
          "nullable": true,
          "type": "BOOLEAN"
        },
        {
          "description": null,
          "name": "has_signature_override",
          "nullable": true,
          "type": "BOOLEAN"
        },
        {
          "description": null,
          "name": "stop_reason",
          "nullable": true,
          "type": "VARCHAR"
        },
        {
          "description": null,
          "name": "status",
          "nullable": true,
          "type": "STRUCT(ok BOOLEAN, error_type VARCHAR, error_msg VARCHAR)"
        }
      ],
      "description": "Wrapper chain hops for callables.",
      "indexes": [],
      "name": "py_inspect_unwrap_hops",
      "primary_key": [
        "repo",
        "commit",
        "root_object_id",
        "hop"
      ],
      "schema": "core",
      "table_key": "core.py_inspect_unwrap_hops"
    },
    "write_settings": {
      "dictionary_encode": false,
      "unify_dictionaries": false
    }
  }
}
