{
  "dataset_id": "core.scip_symbol_relationships",
  "snapshot_id": "3c5af2164daa028b369ed5d8f6a460dc1b2f085d",
  "table_key": "core.scip_symbol_relationships",
  "partition_columns": [
    "repo",
    "commit"
  ],
  "files": [],
  "schema_hash": "8090fd224c11fcae0357db31b34d1e60ca67210857513e10b62ed0239aaed03c",
  "row_count": 0,
  "created_at": "2026-01-04T14:26:45.897856+00:00",
  "extras": {
    "provenance": {
      "derivation_kind": "explicit_override",
      "derivation_source": "scip"
    },
    "settings_fingerprint": "d084197d240ab41f2f8aaf3f4fba09c61eddb74e218bcbd4a288e68f33c189d6",
    "table_schema": {
      "columns": [
        {
          "description": null,
          "name": "repo",
          "nullable": false,
          "type": "VARCHAR"
        },
        {
          "description": null,
          "name": "commit",
          "nullable": false,
          "type": "VARCHAR"
        },
        {
          "description": null,
          "name": "symbol",
          "nullable": false,
          "type": "VARCHAR"
        },
        {
          "description": null,
          "name": "related_symbol",
          "nullable": false,
          "type": "VARCHAR"
        },
        {
          "description": null,
          "name": "relationship_kind",
          "nullable": false,
          "type": "VARCHAR"
        },
        {
          "description": null,
          "name": "created_at",
          "nullable": false,
          "type": "TIMESTAMP"
        }
      ],
      "description": "SCIP symbol relationship edges",
      "indexes": [
        {
          "columns": [
            "symbol"
          ],
          "name": "idx_core_scip_rel_symbol",
          "unique": false
        }
      ],
      "name": "scip_symbol_relationships",
      "primary_key": [
        "repo",
        "commit",
        "symbol",
        "related_symbol",
        "relationship_kind"
      ],
      "schema": "core",
      "table_key": "core.scip_symbol_relationships"
    },
    "write_settings": {
      "dictionary_encode": false,
      "unify_dictionaries": false
    }
  }
}
