{
  "dataset_id": "graph.dfg_edges",
  "snapshot_id": "3c5af2164daa028b369ed5d8f6a460dc1b2f085d",
  "table_key": "graph.dfg_edges",
  "partition_columns": [],
  "files": [],
  "schema_hash": "9c6f5586e18ca6c4980b407238c55fb30a39d63a8de53735985814a8b7a724ba",
  "row_count": 0,
  "created_at": "2026-01-04T14:26:39.952198+00:00",
  "extras": {
    "provenance": {
      "derivation_kind": "explicit_override",
      "derivation_source": "dfg"
    },
    "settings_fingerprint": "d084197d240ab41f2f8aaf3f4fba09c61eddb74e218bcbd4a288e68f33c189d6",
    "table_schema": {
      "columns": [
        {
          "description": null,
          "name": "function_goid_h128",
          "nullable": false,
          "type": "DECIMAL(38,0)"
        },
        {
          "description": null,
          "name": "src_block_id",
          "nullable": false,
          "type": "VARCHAR"
        },
        {
          "description": null,
          "name": "dst_block_id",
          "nullable": false,
          "type": "VARCHAR"
        },
        {
          "description": null,
          "name": "src_var",
          "nullable": true,
          "type": "VARCHAR"
        },
        {
          "description": null,
          "name": "dst_var",
          "nullable": true,
          "type": "VARCHAR"
        },
        {
          "description": null,
          "name": "edge_kind",
          "nullable": true,
          "type": "VARCHAR"
        },
        {
          "description": null,
          "name": "via_phi",
          "nullable": true,
          "type": "BOOLEAN"
        },
        {
          "description": null,
          "name": "use_kind",
          "nullable": true,
          "type": "VARCHAR"
        }
      ],
      "description": "Data-flow edges between blocks/vars",
      "indexes": [
        {
          "columns": [
            "function_goid_h128"
          ],
          "name": "idx_graph_dfg_edges_fn",
          "unique": false
        }
      ],
      "name": "dfg_edges",
      "primary_key": [],
      "schema": "graph",
      "table_key": "graph.dfg_edges"
    },
    "write_settings": {
      "dictionary_encode": false,
      "unify_dictionaries": false
    }
  }
}
