{
  "dataset_id": "core.py_inspect_runtime_state",
  "snapshot_id": "3c5af2164daa028b369ed5d8f6a460dc1b2f085d",
  "table_key": "core.py_inspect_runtime_state",
  "partition_columns": [
    "repo",
    "commit"
  ],
  "files": [],
  "schema_hash": "0566eb09a1353ad9d10fd40d400e9adf4043079859e39b7cfb857c9292b04ffd",
  "row_count": 0,
  "created_at": "2026-01-04T14:26:44.859356+00:00",
  "extras": {
    "provenance": {
      "derivation_kind": "explicit_override",
      "derivation_source": "inspect"
    },
    "settings_fingerprint": "d084197d240ab41f2f8aaf3f4fba09c61eddb74e218bcbd4a288e68f33c189d6",
    "table_schema": {
      "columns": [
        {
          "description": null,
          "name": "repo",
          "nullable": false,
          "type": "VARCHAR"
        },
        {
          "description": null,
          "name": "commit",
          "nullable": false,
          "type": "VARCHAR"
        },
        {
          "description": null,
          "name": "mode",
          "nullable": false,
          "type": "VARCHAR"
        },
        {
          "description": null,
          "name": "object_id",
          "nullable": false,
          "type": "VARCHAR"
        },
        {
          "description": null,
          "name": "object_kind",
          "nullable": true,
          "type": "VARCHAR"
        },
        {
          "description": null,
          "name": "state_kind",
          "nullable": true,
          "type": "VARCHAR"
        },
        {
          "description": null,
          "name": "state",
          "nullable": true,
          "type": "VARCHAR"
        },
        {
          "description": null,
          "name": "frame_object_id",
          "nullable": true,
          "type": "VARCHAR"
        },
        {
          "description": null,
          "name": "frame_file",
          "nullable": true,
          "type": "VARCHAR"
        },
        {
          "description": null,
          "name": "frame_module",
          "nullable": true,
          "type": "VARCHAR"
        },
        {
          "description": null,
          "name": "frame_code_qualname",
          "nullable": true,
          "type": "VARCHAR"
        },
        {
          "description": null,
          "name": "frame_code_name",
          "nullable": true,
          "type": "VARCHAR"
        },
        {
          "description": null,
          "name": "frame_firstlineno",
          "nullable": true,
          "type": "INTEGER"
        },
        {
          "description": null,
          "name": "frame_line",
          "nullable": true,
          "type": "INTEGER"
        },
        {
          "description": null,
          "name": "frame_start_line",
          "nullable": true,
          "type": "INTEGER"
        },
        {
          "description": null,
          "name": "frame_end_line",
          "nullable": true,
          "type": "INTEGER"
        },
        {
          "description": null,
          "name": "frame_start_col",
          "nullable": true,
          "type": "INTEGER"
        },
        {
          "description": null,
          "name": "frame_end_col",
          "nullable": true,
          "type": "INTEGER"
        },
        {
          "description": null,
          "name": "frame_offset",
          "nullable": true,
          "type": "INTEGER"
        },
        {
          "description": null,
          "name": "locals",
          "nullable": true,
          "type": "LIST(STRUCT(name VARCHAR, value STRUCT(kind VARCHAR, type_qualname VARCHAR, repr_trunc VARCHAR, repr_len INTEGER, repr_sha256 BLOB, is_callable BOOLEAN, is_descriptor BOOLEAN, is_builtin BOOLEAN)))"
        },
        {
          "description": null,
          "name": "status",
          "nullable": true,
          "type": "STRUCT(ok BOOLEAN, error_type VARCHAR, error_msg VARCHAR)"
        }
      ],
      "description": "Runtime state snapshots for frames, tracebacks, and generators.",
      "indexes": [],
      "name": "py_inspect_runtime_state",
      "primary_key": [
        "repo",
        "commit",
        "object_id",
        "state_kind"
      ],
      "schema": "core",
      "table_key": "core.py_inspect_runtime_state"
    },
    "write_settings": {
      "dictionary_encode": false,
      "unify_dictionaries": false
    }
  }
}
