{
  "dataset_id": "core.py_bc_blocks",
  "snapshot_id": "3c5af2164daa028b369ed5d8f6a460dc1b2f085d",
  "table_key": "core.py_bc_blocks",
  "partition_columns": [
    "repo",
    "commit"
  ],
  "files": [],
  "schema_hash": "c5bc62d4620bbf71d44aadce4cb47bf14ead142f32741b87ee8849e9d0beb78b",
  "row_count": 0,
  "created_at": "2026-01-04T14:26:42.528717+00:00",
  "extras": {
    "provenance": {
      "derivation_kind": "explicit_override",
      "derivation_source": "bytecode"
    },
    "settings_fingerprint": "d084197d240ab41f2f8aaf3f4fba09c61eddb74e218bcbd4a288e68f33c189d6",
    "table_schema": {
      "columns": [
        {
          "description": null,
          "name": "repo",
          "nullable": false,
          "type": "VARCHAR"
        },
        {
          "description": null,
          "name": "commit",
          "nullable": false,
          "type": "VARCHAR"
        },
        {
          "description": null,
          "name": "rel_path",
          "nullable": false,
          "type": "VARCHAR"
        },
        {
          "description": null,
          "name": "block_id",
          "nullable": false,
          "type": "VARCHAR"
        },
        {
          "description": null,
          "name": "code_unit_id",
          "nullable": false,
          "type": "VARCHAR"
        },
        {
          "description": null,
          "name": "start_offset",
          "nullable": true,
          "type": "INTEGER"
        },
        {
          "description": null,
          "name": "end_offset",
          "nullable": true,
          "type": "INTEGER"
        },
        {
          "description": null,
          "name": "start_label",
          "nullable": true,
          "type": "VARCHAR"
        },
        {
          "description": null,
          "name": "kind",
          "nullable": true,
          "type": "VARCHAR"
        },
        {
          "description": null,
          "name": "anchor_span_start_byte",
          "nullable": true,
          "type": "BIGINT"
        },
        {
          "description": null,
          "name": "anchor_span_end_byte",
          "nullable": true,
          "type": "BIGINT"
        },
        {
          "description": null,
          "name": "first_instr_index",
          "nullable": true,
          "type": "INTEGER"
        },
        {
          "description": null,
          "name": "last_instr_index",
          "nullable": true,
          "type": "INTEGER"
        }
      ],
      "description": "Basic block inventory derived from bytecode.",
      "indexes": [],
      "name": "py_bc_blocks",
      "primary_key": [
        "repo",
        "commit",
        "rel_path",
        "block_id"
      ],
      "schema": "core",
      "table_key": "core.py_bc_blocks"
    },
    "write_settings": {
      "dictionary_encode": false,
      "unify_dictionaries": false
    }
  }
}
