{
  "dataset_id": "graph.call_graph_nodes",
  "snapshot_id": "3c5af2164daa028b369ed5d8f6a460dc1b2f085d",
  "table_key": "graph.call_graph_nodes",
  "partition_columns": [],
  "files": [],
  "schema_hash": "01f41265f97c9995b589c5fcd7ece677cc3b165620500425cbfbae717c847fbf",
  "row_count": 0,
  "created_at": "2026-01-04T14:26:34.204934+00:00",
  "extras": {
    "provenance": {
      "derivation_kind": "explicit_override",
      "derivation_source": "call_graph"
    },
    "settings_fingerprint": "d084197d240ab41f2f8aaf3f4fba09c61eddb74e218bcbd4a288e68f33c189d6",
    "table_schema": {
      "columns": [
        {
          "description": null,
          "name": "goid_h128",
          "nullable": false,
          "type": "DECIMAL(38,0)"
        },
        {
          "description": null,
          "name": "language",
          "nullable": false,
          "type": "VARCHAR"
        },
        {
          "description": null,
          "name": "kind",
          "nullable": false,
          "type": "VARCHAR"
        },
        {
          "description": null,
          "name": "arity",
          "nullable": false,
          "type": "INTEGER"
        },
        {
          "description": null,
          "name": "is_public",
          "nullable": false,
          "type": "BOOLEAN"
        },
        {
          "description": null,
          "name": "rel_path",
          "nullable": false,
          "type": "VARCHAR"
        }
      ],
      "description": "Functions and methods participating in the call graph",
      "indexes": [],
      "name": "call_graph_nodes",
      "primary_key": [
        "goid_h128"
      ],
      "schema": "graph",
      "table_key": "graph.call_graph_nodes"
    },
    "write_settings": {
      "dictionary_encode": false,
      "unify_dictionaries": false
    }
  }
}
