{
  "dataset_id": "core.py_inspect_signatures",
  "snapshot_id": "3c5af2164daa028b369ed5d8f6a460dc1b2f085d",
  "table_key": "core.py_inspect_signatures",
  "partition_columns": [
    "repo",
    "commit"
  ],
  "files": [],
  "schema_hash": "4748e629b3206fcdb145e458298ad6317f42500c24ce54689d870ec1b0a6dde0",
  "row_count": 0,
  "created_at": "2026-01-04T14:26:44.221138+00:00",
  "extras": {
    "provenance": {
      "derivation_kind": "explicit_override",
      "derivation_source": "inspect"
    },
    "settings_fingerprint": "d084197d240ab41f2f8aaf3f4fba09c61eddb74e218bcbd4a288e68f33c189d6",
    "table_schema": {
      "columns": [
        {
          "description": null,
          "name": "repo",
          "nullable": false,
          "type": "VARCHAR"
        },
        {
          "description": null,
          "name": "commit",
          "nullable": false,
          "type": "VARCHAR"
        },
        {
          "description": null,
          "name": "mode",
          "nullable": false,
          "type": "VARCHAR"
        },
        {
          "description": null,
          "name": "signature_id",
          "nullable": false,
          "type": "VARCHAR"
        },
        {
          "description": null,
          "name": "object_id",
          "nullable": false,
          "type": "VARCHAR"
        },
        {
          "description": null,
          "name": "variant",
          "nullable": true,
          "type": "VARCHAR"
        },
        {
          "description": null,
          "name": "follow_wrapped",
          "nullable": true,
          "type": "BOOLEAN"
        },
        {
          "description": null,
          "name": "eval_str",
          "nullable": true,
          "type": "BOOLEAN"
        },
        {
          "description": null,
          "name": "effective_object_id",
          "nullable": true,
          "type": "VARCHAR"
        },
        {
          "description": null,
          "name": "sig_text",
          "nullable": true,
          "type": "VARCHAR"
        },
        {
          "description": null,
          "name": "sig_format",
          "nullable": true,
          "type": "VARCHAR"
        },
        {
          "description": null,
          "name": "return_annotation",
          "nullable": true,
          "type": "STRUCT(kind VARCHAR, type_qualname VARCHAR, repr_trunc VARCHAR, repr_len INTEGER, repr_sha256 BLOB, is_callable BOOLEAN, is_descriptor BOOLEAN, is_builtin BOOLEAN)"
        },
        {
          "description": null,
          "name": "has_varargs",
          "nullable": true,
          "type": "BOOLEAN"
        },
        {
          "description": null,
          "name": "has_varkw",
          "nullable": true,
          "type": "BOOLEAN"
        },
        {
          "description": null,
          "name": "status",
          "nullable": true,
          "type": "STRUCT(ok BOOLEAN, error_type VARCHAR, error_msg VARCHAR)"
        }
      ],
      "description": "Signature facts extracted via inspect.",
      "indexes": [],
      "name": "py_inspect_signatures",
      "primary_key": [
        "repo",
        "commit",
        "signature_id"
      ],
      "schema": "core",
      "table_key": "core.py_inspect_signatures"
    },
    "write_settings": {
      "dictionary_encode": false,
      "unify_dictionaries": false
    }
  }
}
