{
  "dataset_id": "core.py_bc_defuse_events",
  "snapshot_id": "3c5af2164daa028b369ed5d8f6a460dc1b2f085d",
  "table_key": "core.py_bc_defuse_events",
  "partition_columns": [
    "repo",
    "commit"
  ],
  "files": [],
  "schema_hash": "83f537e0004136d766ac8734cd02d4b9464c9ada0154c1accb62cb325d5f3576",
  "row_count": 0,
  "created_at": "2026-01-04T14:26:42.839756+00:00",
  "extras": {
    "provenance": {
      "derivation_kind": "explicit_override",
      "derivation_source": "bytecode"
    },
    "settings_fingerprint": "d084197d240ab41f2f8aaf3f4fba09c61eddb74e218bcbd4a288e68f33c189d6",
    "table_schema": {
      "columns": [
        {
          "description": null,
          "name": "repo",
          "nullable": false,
          "type": "VARCHAR"
        },
        {
          "description": null,
          "name": "commit",
          "nullable": false,
          "type": "VARCHAR"
        },
        {
          "description": null,
          "name": "rel_path",
          "nullable": false,
          "type": "VARCHAR"
        },
        {
          "description": null,
          "name": "event_id",
          "nullable": false,
          "type": "VARCHAR"
        },
        {
          "description": null,
          "name": "code_unit_id",
          "nullable": false,
          "type": "VARCHAR"
        },
        {
          "description": null,
          "name": "instr_id",
          "nullable": false,
          "type": "VARCHAR"
        },
        {
          "description": null,
          "name": "instr_index",
          "nullable": true,
          "type": "INTEGER"
        },
        {
          "description": null,
          "name": "event_kind",
          "nullable": false,
          "type": "VARCHAR"
        },
        {
          "description": null,
          "name": "space",
          "nullable": true,
          "type": "VARCHAR"
        },
        {
          "description": null,
          "name": "name",
          "nullable": true,
          "type": "VARCHAR"
        },
        {
          "description": null,
          "name": "confidence",
          "nullable": true,
          "type": "DOUBLE"
        }
      ],
      "description": "Bytecode def/use events for DFG construction.",
      "indexes": [],
      "name": "py_bc_defuse_events",
      "primary_key": [
        "repo",
        "commit",
        "rel_path",
        "event_id"
      ],
      "schema": "core",
      "table_key": "core.py_bc_defuse_events"
    },
    "write_settings": {
      "dictionary_encode": false,
      "unify_dictionaries": false
    }
  }
}
