{
  "dataset_id": "graph.cfg_blocks",
  "snapshot_id": "3c5af2164daa028b369ed5d8f6a460dc1b2f085d",
  "table_key": "graph.cfg_blocks",
  "partition_columns": [],
  "files": [],
  "schema_hash": "a3b1ef27eedcd1b082b7c34cb17f1d45266278dc2966d4a285d041952ac5ee38",
  "row_count": 0,
  "created_at": "2026-01-04T14:26:34.698553+00:00",
  "extras": {
    "provenance": {
      "derivation_kind": "explicit_override",
      "derivation_source": "cfg"
    },
    "settings_fingerprint": "d084197d240ab41f2f8aaf3f4fba09c61eddb74e218bcbd4a288e68f33c189d6",
    "table_schema": {
      "columns": [
        {
          "description": null,
          "name": "function_goid_h128",
          "nullable": false,
          "type": "DECIMAL(38,0)"
        },
        {
          "description": null,
          "name": "block_idx",
          "nullable": false,
          "type": "INTEGER"
        },
        {
          "description": null,
          "name": "block_id",
          "nullable": false,
          "type": "VARCHAR"
        },
        {
          "description": null,
          "name": "label",
          "nullable": false,
          "type": "VARCHAR"
        },
        {
          "description": null,
          "name": "file_path",
          "nullable": false,
          "type": "VARCHAR"
        },
        {
          "description": null,
          "name": "start_line",
          "nullable": false,
          "type": "INTEGER"
        },
        {
          "description": null,
          "name": "end_line",
          "nullable": false,
          "type": "INTEGER"
        },
        {
          "description": null,
          "name": "kind",
          "nullable": false,
          "type": "VARCHAR"
        },
        {
          "description": null,
          "name": "stmts_json",
          "nullable": false,
          "type": "BLOB"
        },
        {
          "description": null,
          "name": "in_degree",
          "nullable": false,
          "type": "INTEGER"
        },
        {
          "description": null,
          "name": "out_degree",
          "nullable": false,
          "type": "INTEGER"
        }
      ],
      "description": "Control-flow blocks per function",
      "indexes": [
        {
          "columns": [
            "function_goid_h128"
          ],
          "name": "idx_graph_cfg_blocks_fn",
          "unique": false
        }
      ],
      "name": "cfg_blocks",
      "primary_key": [
        "function_goid_h128",
        "block_idx"
      ],
      "schema": "graph",
      "table_key": "graph.cfg_blocks"
    },
    "write_settings": {
      "dictionary_encode": false,
      "unify_dictionaries": false
    }
  }
}
