{
  "dataset_id": "core.repo_map",
  "snapshot_id": "3c5af2164daa028b369ed5d8f6a460dc1b2f085d",
  "table_key": "core.repo_map",
  "partition_columns": [
    "repo",
    "commit"
  ],
  "files": [],
  "schema_hash": "faed8ffe21d24948bb6f261c118ccb33fd0b731dc0723afeb47722f28a300837",
  "row_count": 0,
  "created_at": "2026-01-04T14:26:41.320919+00:00",
  "extras": {
    "provenance": {
      "derivation_kind": "explicit_override",
      "derivation_source": "modules"
    },
    "settings_fingerprint": "d084197d240ab41f2f8aaf3f4fba09c61eddb74e218bcbd4a288e68f33c189d6",
    "table_schema": {
      "columns": [
        {
          "description": null,
          "name": "repo",
          "nullable": false,
          "type": "VARCHAR"
        },
        {
          "description": null,
          "name": "commit",
          "nullable": false,
          "type": "VARCHAR"
        },
        {
          "description": null,
          "name": "modules",
          "nullable": true,
          "type": "MAP(VARCHAR, VARCHAR)"
        },
        {
          "description": null,
          "name": "overlays",
          "nullable": true,
          "type": "MAP(VARCHAR, VARCHAR)"
        },
        {
          "description": null,
          "name": "generated_at",
          "nullable": true,
          "type": "TIMESTAMP"
        }
      ],
      "description": "Per-commit module manifest and overlays",
      "indexes": [],
      "name": "repo_map",
      "primary_key": [
        "repo",
        "commit"
      ],
      "schema": "core",
      "table_key": "core.repo_map"
    },
    "write_settings": {
      "dictionary_encode": false,
      "unify_dictionaries": false
    }
  }
}
